,ticker,title
8,SBIN,Related News
9,SBIN,"April jobs data, Apple earnings, Block and bitcoin: 3 Things"
10,SBIN,ATxSummit returns on 30-31 May 2024
11,SBIN,Apple beats Q2 estimates as iPhone sales decline 10%
12,SBIN,"Apple earnings see 10% iPhone sales drop, massive buyback fuels stock jump"
13,SBIN,Apple Q2 earnings: Key takeaways
14,SBIN,"April jobs report, Fedspeak, earnings: What to watch"
15,SBIN,Ready To Move-In Triplex Villaments Starting @ 9 Cr* |...
16,SBIN,"Block stock pops on Q1 earnings, guidance boost"
17,SBIN,Apple adds more carve-outs to its EU core tech fee after criticism from devs
18,SBIN,Haun Ventures is riding the bitcoin high
19,SBIN,"Fed holds rates, Apple earnings, Peloton CEO: 3 Things"
20,SBIN,3 BHK Garden and Terrace houses from Rs. 2.05 Cr in...
21,SBIN,Apple Stock Is More Expensive Than You Think
22,SBIN,Dow Jones Futures Rally 500 Points On Weak Jobs Report; Apple Surges On Buyback
23,SBIN,Mercadolibre Earnings: It's My Third-Largest Position for This Reason
24,SBIN,Square Stock Pops On Earnings Beat. CEO Dorsey Lays Out New Bitcoin Plans.
25,SBIN,2 & 3 BHK Homes by Provident Botanico at Whitefield at 84...
26,SBIN,Hershey's (NYSE:HSY) five-year earnings growth trails the respectable shareholder returns
27,SBIN,US STOCKS-Wall St set to open sharply higher on soft jobs data
28,SBIN,Apple Stock Surges. Earnings Were a Huge Relief.
29,SBIN,3 Things Apple Isn't Shouting From the Rooftops
30,SBIN,Ugadi Exclusive: Grab 8 Lakhs in Special Offers! Don't...
31,SBIN,3 Vanguard ETFs to Buy If You're Looking for Reliable Passive Income
32,SBIN,"These Stocks Are Moving the Most Today: Apple, Amgen, Expedia, Block, Coinbase, Cloudflare, Fortinet, and More"
33,SBIN,The Tech Stocks Making Waves Today
34,SBIN,"Cloudflare, Block, Fortinet, Palo Alto, and Other Tech Stocks in Focus Today"
35,SBIN,Codename TeakVille | Invest today & Earn 9 Lac* Rental...
36,SBIN,XPO cruises past Q1 consensus estimate
37,SBIN,"Streamers, Big Banks, and Cyberattacks"
38,SBIN,Coinbase Stock Falls After Earnings. Bitcoin Is Casting Dark Clouds.
39,SBIN,"DraftKings Stock Jumps As Narrowed Loss, Revenue Outpace Views"
40,SBIN,How a Simple $250 Amazon CFD Investment Can Benefit You
41,SBIN,Expedia Stock Tumbles Despite Earnings and Revenue Beat. Here’s Why.
42,SBIN,Apple Buys Itself Some Time for an AI Boost
43,SBIN,"Apple Sales Fall as iPhone, China Businesses Remain Sluggish"
44,SBIN,"Coinbase Delivers Major Earnings, Revenue Beat. But Analysts Are Mixed On Outlook."
45,SBIN,Bangalore: Personalized 2BHK Interiors built to your budget.
46,SBIN,Tesla Stock’s Towering AI Valuation Is Detached From Reality
47,SBIN,Q2 2024 Apple Inc Earnings Call
48,SBIN,"Dow Jones Futures Rise As Apple Jumps On Buyback, But Jobs Report Looms"
49,SBIN,Hershey Reports First-Quarter 2024 Earnings: Surpasses Analyst Revenue Forecasts
50,SBIN,AI & ML Course with UT Austin Certificate | 1: 1 Mentorship
51,SBIN,XPO Inc Reports First Quarter 2024 Earnings: Performance Analysis and Comparison with Analyst ...
52,SBIN,Cloudflare Tumbles As Revenue Outlook Underwhelms Investors
53,SBIN,Novo Slides as Amgen Fuels Obesity Drug Competition Fears
54,SBIN,"fuboTV (NYSE:FUBO) Reports Upbeat Q1, Stock Soars"
55,SBIN,Ecocity Villa Plots @ ₹4000 psf onwards
56,SBIN,"XPO Stock Soars on Earnings Beat. The U.S. Freight Market Is Soft, Though."
57,SBIN,Q1 2024 Coinbase Global Inc Earnings Call
58,SBIN,Amgen Soars as CEO Touts Experimental Obesity Drug’s Progress
59,SBIN,
60,SBIN,
61,SBIN,
